{
  "contract_version": "1.0",
  "task_id": "MMO-EX-03",
  "project_id": "P-MICP-COLUMN-01",
  "request": "全流程：求解机理模型、反演参数、做敏感性分析与多目标优化，并给出鲁棒性评估",
  "action": "analyze",
  "skill_version": "1.0.0",
  "controller_version": "obsidian-ctl-0.1.0",
  "timestamp": "2026-08-07T00:00:00Z",
  "model_specification": {
    "purpose": "OPTIMIZATION",
    "model_kind": "ode",
    "state_variables": ["urea", "ca", "nh4", "biomass", "calcite"],
    "parameters": [
      {"name": "k_ure", "role": "calibration", "value": 1e-4, "unit": "1/s", "bounds": [1e-6, 1e-2]},
      {"name": "k_pre", "role": "calibration", "value": 1e-4, "unit": "1/s", "bounds": [1e-6, 1e-2]}
    ],
    "parameter_sources": [
      {"parameter": "k_ure", "source": "fitted; prior Lauchnor et al. 2015"},
      {"parameter": "k_pre", "source": "fitted; prior Palandri & Kharaka 2004"}
    ],
    "equations": {
      "kind": "ode",
      "ureolysis": "dU/dt = -k_ure*B*U/(K_half+U)",
      "precipitation": "r_pre = k_pre*min(Ca, CO3)"
    },
    "initial_conditions": {"urea0": 500, "ca0": 500, "biomass0": 1.0, "phi0": 0.4, "t_end": 86400},
    "observations": ["urea", "nh4", "caco3"],
    "error_model": "additive_gaussian",
    "space_scale": "lab_column",
    "time_scale": "days",
    "assumptions": ["well-mixed batch", "no transport"]
  },
  "calibration": {
    "model": "kinetic_urea",
    "data": [
      {"t": 6912, "urea": 499.57, "caco3": 0.011},
      {"t": 13824, "urea": 499.14, "caco3": 0.038},
      {"t": 20736, "urea": 498.71, "caco3": 0.074},
      {"t": 27648, "urea": 498.28, "caco3": 0.113},
      {"t": 34560, "urea": 497.86, "caco3": 0.154},
      {"t": 41472, "urea": 497.43, "caco3": 0.196},
      {"t": 48384, "urea": 497.00, "caco3": 0.239},
      {"t": 55296, "urea": 496.57, "caco3": 0.282},
      {"t": 62208, "urea": 496.14, "caco3": 0.324},
      {"t": 69120, "urea": 495.71, "caco3": 0.367},
      {"t": 76032, "urea": 495.29, "caco3": 0.410},
      {"t": 86400, "urea": 494.67, "caco3": 0.472}
    ],
    "parameters": [
      {"name": "k_ure", "value": 1e-4, "bounds": [1e-6, 1e-2]},
      {"name": "k_pre", "value": 1e-4, "bounds": [1e-6, 1e-2]}
    ]
  },
  "sensitivity": {
    "parameters": ["k_ure", "k_pre"],
    "bounds": [[1e-5, 3e-4], [1e-5, 3e-4]],
    "target": "caco3_kg",
    "method": "sobol",
    "n_base": 300
  },
  "optimization": {
    "mode": "multi",
    "variables": [{"name": "k_ure"}, {"name": "k_pre"}],
    "bounds": [[1e-5, 5e-4], [1e-5, 5e-4]],
    "objectives": [
      {"name": "max_caco3", "target": {"output": "caco3_kg"}, "maximize": true},
      {"name": "min_ammonia", "target": {"output": "ammonia_release"}, "maximize": false}
    ]
  },
  "uncertainty": {
    "parameters": [
      {"name": "k_ure", "dist": "uniform", "low": 5e-5, "high": 3e-4},
      {"name": "k_pre", "dist": "uniform", "low": 5e-5, "high": 3e-4}
    ],
    "target": "caco3_kg",
    "n_samples": 100
  },
  "constraints": {"random_seed": 7, "pop_size": 24, "n_gen": 25, "robustness_samples": 15},
  "risk_level": "low",
  "human_approval_state": "not_required"
}
