{
  "contract_version": "1.0",
  "task_id": "MMO-EX-02",
  "project_id": "P-MICP-COLUMN-01",
  "request": "用合成尿素+CaCO3时间序列反演 k_ure 与 k_pre，做可识别性分析与留出验证",
  "action": "fit",
  "skill_version": "1.0.0",
  "controller_version": "obsidian-ctl-0.1.0",
  "timestamp": "2026-08-07T00:00:00Z",
  "model_specification": {
    "purpose": "PARAMETER_INFERENCE",
    "model_kind": "ode",
    "state_variables": ["urea", "ca", "nh4", "biomass", "calcite"],
    "parameters": [
      {"name": "k_ure", "role": "calibration", "value": 1e-4, "unit": "1/s", "bounds": [1e-6, 1e-2],
       "source": "fitted from urea time series"},
      {"name": "k_pre", "role": "calibration", "value": 1e-4, "unit": "1/s", "bounds": [1e-6, 1e-2],
       "source": "fitted from urea + CaCO3 time series"}
    ],
    "parameter_sources": [
      {"parameter": "k_ure", "source": "fitted; prior from Lauchnor et al. 2015"},
      {"parameter": "k_pre", "source": "fitted; prior from Palandri & Kharaka 2004"}
    ],
    "equations": {
      "kind": "ode",
      "ureolysis": "dU/dt = -k_ure*B*U/(K_half+U)",
      "precipitation": "r_pre = k_pre*min(Ca, CO3)"
    },
    "initial_conditions": {"urea0": 500, "ca0": 500, "biomass0": 1.0, "phi0": 0.4},
    "observations": ["urea", "nh4", "caco3"],
    "error_model": "additive_gaussian",
    "space_scale": "lab_column",
    "time_scale": "days"
  },
  "calibration": {
    "model": "kinetic_urea",
    "data": [
      {"t": 6912, "urea": 499.57, "caco3": 0.011},
      {"t": 13824, "urea": 499.14, "caco3": 0.038},
      {"t": 20736, "urea": 498.71, "caco3": 0.074},
      {"t": 27648, "urea": 498.28, "caco3": 0.113},
      {"t": 34560, "urea": 497.86, "caco3": 0.154},
      {"t": 41472, "urea": 497.43, "caco3": 0.196},
      {"t": 48384, "urea": 497.00, "caco3": 0.239},
      {"t": 55296, "urea": 496.57, "caco3": 0.282},
      {"t": 62208, "urea": 496.14, "caco3": 0.324},
      {"t": 69120, "urea": 495.71, "caco3": 0.367},
      {"t": 76032, "urea": 495.29, "caco3": 0.410},
      {"t": 86400, "urea": 494.67, "caco3": 0.472}
    ],
    "parameters": [
      {"name": "k_ure", "value": 1e-4, "bounds": [1e-6, 1e-2]},
      {"name": "k_pre", "value": 1e-4, "bounds": [1e-6, 1e-2]}
    ]
  },
  "constraints": {"random_seed": 42, "n_starts": 3},
  "risk_level": "low",
  "human_approval_state": "not_required"
}
